<?xml version="1.0" encoding="UTF-8"?>
<!DOCTYPE alumno SYSTEM "6_3.dtd">

<alumno DNI="11112222A">
<nombre>Adrian Miguel</nombre>
<apellidos>Lopez Casanueva</apellidos>
<edad>23</edad>
<direccion>
<calle>Camino de Rubin</calle>
<numero>15</numero>
<piso>1</piso>
<poblacion>Gijon</poblacion>
<codigo-postal>33213</codigo-postal>
</direccion>
<nota>10</nota>
<comentario>Excelente estudiante</comentario>
</alumno>